{
  "timestamp": "2026-08-17T12:55:00-04:00",
  "symbol": "SPX",
  "underlying_price": 7769.0,
  "gamma_flip": null,
  "zero_gamma": null,
  "call_wall": 7900,
  "put_wall": 7755,
  "hvl": 7770,
  "volatility_trigger": null,
  "blind_spots": [],
  "positive_gamma_zones": [],
  "negative_gamma_zones": [],
  "liquidity_vacuums": [],
  "expected_move_upper": 7834.34,
  "expected_move_lower": 7717.6,
  "metadata": {
    "source": "MenthorQ gateway API",
    "data_timestamp": "2026-08-17T12:45:00-04:00",
    "retrieved_at": "2026-08-17T16:59:43.908Z",
    "field_mapping": {
      "call_wall": "call_resistance",
      "put_wall": "put_support",
      "hvl": "hvl (not relabeled as gamma_flip)",
      "expected_move_upper": "max_1d",
      "expected_move_lower": "min_1d"
    },
    "call_resistance_0dte": 7785,
    "put_support_0dte": 7755,
    "matrix_totals": {
      "net_gex": 453820034.22383857,
      "abs_gex": 4255173231.977463,
      "net_dex": 1330834713612.8022,
      "abs_dex": 2870793709776.7227,
      "net_oi": -3072376,
      "abs_oi": 13922588
    }
  }
}
